{"audit_evidence":{"audit":{"audit_id":"3e66360fe3fdc400be4b5bab0cc522f53ff0a90a5dedda56b43f56df955b287d","envelope_id":"1ce5e777ec3abb00a21284477249850cfd2927a76544705dc8039a13da660621","findings_count":0,"report_generated_at":"2026-08-13T20:00:00Z","report_sha256":"22293d8d9050ac9a60a024d9d8cf5a18f64adf42d8c5b22fdd73eb014ccfd18b","verdict":"PASS"},"authority_sources":[{"artifact":"task_authority","kind":"task_authority","reference":"evidence/task-authority.md","sha256":"d012821fa0755f9e8bf2450381ef93cd3eadb125cc5b01bbdc2753af22fa782c","size":3315}],"changed_files":[{"file_type":"regular","path":"AGENTS.md","sources":["unstaged"]},{"file_type":"regular","path":"CURRENT_MISSION.md","sources":["unstaged"]},{"file_type":"regular","path":"README.md","sources":["unstaged"]},{"file_type":"regular","path":"docs/README.md","sources":["unstaged"]},{"file_type":"regular","path":"docs/decisions/governance/repository-records.md","sources":["unstaged"]},{"file_type":"regular","path":"docs/governance/README.md","sources":["unstaged"]},{"file_type":"regular","path":"docs/governance/mission-control-context.md","sources":["unstaged"]},{"file_type":"regular","path":"tests/governance/test_repository_governance.py","sources":["unstaged"]},{"file_type":"regular","path":"tools/governance/repository.py","sources":["unstaged"]}],"deferred_work":["After a fresh zero-finding independent audit and external record verification, route the unchanged candidate and exact-bound audit package to the currently authorized LSO landing workflow."],"limitations":["The corrected candidate is unstaged and uncommitted.","No push, publication, landing, deployment, live-data mutation, or completion is claimed.","This engineer report claims implementation and testing only; it does not claim the result of the independent audit."],"objective":"Correct three misleading governance phrases so the CEO–COO–Quarterback candidate accurately describes mandatory external Crew Chief record creation, strategic-mission completion labels, and mission-metadata-only workstream requirements without changing the selected operating model.","repository":{"authorized_untracked":[],"base_commit":"1ede3dd023724fda046fceef56b7ee6bf72178e7","branch":"codex/ceo-coo-quarterback-governance-20260813","candidate_state_hash":"d6cfe38e617c069951d835827512d9b2c11056652222937105a647602e1fa81d","head_commit":"1ede3dd023724fda046fceef56b7ee6bf72178e7","manifest":{"path":"evidence-manifest.json","sha256":"3d060794f5f4127fd2487ba7c526300a957b37d8ff9f7963e38de14914c23a54","size":23978},"repository_id":"eb0f6a5a0969292bb8f00815604e4cf612a956b48056f2245e614f6d1022dd41","repository_root":"/Users/davidshimmon/.codex/worktrees/52e9/msaib-wingman","status_porcelain_v1":[" M AGENTS.md"," M CURRENT_MISSION.md"," M README.md"," M docs/README.md"," M docs/decisions/governance/repository-records.md"," M docs/governance/README.md"," M docs/governance/mission-control-context.md"," M tests/governance/test_repository_governance.py"," M tools/governance/repository.py"],"subject_mode":"working-tree"},"scope":{"excluded":["Architecture redesign, new registry, or universal task ledger","Crew Chief runtime, schema, or history changes","LSO implementation or executable authority changes","Historical mission-record changes","Application, product, deployment, migration, live-data, or production changes"],"included":["AGENTS.md","CURRENT_MISSION.md","README.md","docs/README.md","docs/decisions/governance/repository-records.md","docs/governance/README.md","docs/governance/mission-control-context.md","tests/governance/test_repository_governance.py","tools/governance/repository.py"]},"tests_and_checks":{"candidate":{"base":"1ede3dd023724fda046fceef56b7ee6bf72178e7","binary_diff_sha256":"d0d8ff0528828e2980b38a2db0e03f41ec9037fd75bd6f96741bb29c1f4027a8","head":"1ede3dd023724fda046fceef56b7ee6bf72178e7","include_working_tree":true,"path_count":9},"complete_offline_suite":"518 passed in 268.253s","focused_tests":{"acceptance_critical":"5 passed in 4.437s","covered_behavior":["bounded tasks proceed between strategic missions","multiple active mission workstreams render","CURRENT_MISSION.md is status rather than implementation permission","zero portfolio-primary renders without StopIteration or fabrication","completion labels identify a recorded strategic mission rather than universal completed work","workstream metadata requirements apply to recorded mission workstreams rather than ordinary bounded tasks","Crew Chief external proposal creation is mandatory after zero-finding PASS and complete reconciliation, and the record remains eligible for later LSO landing"],"module":"38 passed in 13.369s"},"governance_validation":["Repository governance validation passed.","Generated CURRENT_MISSION.md and Mission Control context are fresh against canonical mission metadata.","The index is empty and git diff --check passes for the exact nine paths."],"static_checks":["Ruff passed on both changed Python files.","Python compilation passed on both changed Python files.","Changed-path whitespace validation passed."]}},"audit_evidence_sha256":"c3815362951ce1f5e8ac3bfc9b7bfcb4f7cb0a666cf66a09534cae42bc45a5e2","canary":"CANOPY-7C2F-ATLAS","generated_at":"2026-08-13T19:53:24Z","landing_completion":{"completion_state":"complete_only_after_atomic_publication_and_live_two_ref_verification","implementation_commit_hashes":["b7046cc00b95af04564454e1977cf2a8501901c0"],"landing_result":"Authorized result: one atomic non-force publication makes both named remote target refs resolve to the record-only commit whose parent is the verified implementation commit; the landing is complete only after live verification confirms exact containment and bytes.","landing_timestamps":{"continuation_preconditions_verified_at":"2026-08-13T20:15:50Z","record_finalized_at":"2026-08-13T20:15:57Z"},"remote_refs":["source=refs/heads/codex/ceo-coo-quarterback-governance-20260813;target=refs/heads/codex/ceo-coo-quarterback-governance-20260813","source=refs/heads/codex/ceo-coo-quarterback-governance-20260813;target=refs/heads/main"]},"lso_handoff":{"approval_claimed":false,"completion_claimed":false,"next_action":"Validate this proposal against the unchanged audited candidate, add verified landing facts, and land both together only under Maverick's authorization.","repository_mutation_claimed":false,"required_landing_facts":["implementation_commit_hashes","remote_refs","landing_result","landing_timestamps","completion_state"],"responsible_role":"LSO"},"record_type":"crew_chief_closeout","schema_version":"1.0","status":"landed"}
